<?xml version="1.0" encoding="UTF-8"?>
<!ELEMENT enigmes (niveau+)>
<!ELEMENT niveau (enigme+)>
<!ELEMENT enigme (question,reponse,indice)>
<!ELEMENT question (#PCDATA)>
<!ELEMENT reponse (#PCDATA)>
<!ELEMENT indice (#PCDATA)>